{
	"$schema": "http://json-schema.org/draft-07/schema#",
	"title": "Achievements",
	"description": "A list of achievements",
	"type": "array",
	"minItems": 1,
	"items": {
		"type": "object",
		"properties": {
			"key": {
				"type": "string",
				"pattern": "^[a-zA-Z0-9_]*$"
			},
			"name": {
				"type": "string"
			},
			"description": {
				"type": "string"
			},
			"points": {
				"type": "integer",
				"minimum": 0
			},
			"additional": {
				"type": "object",
				"properties": {
					"prefix": {
						"type": "string"
					},
					"text": {
						"type": "string"
					}
				},
				"required": ["prefix", "text"]
			},
			"maxProgress": {
				"type": "integer"
			}
		},
		"required": ["key", "name", "description", "points"]
	}
}